{
  "site": "app.slack.com",
  "audited_at": "2026-09-12T14:47:51Z",
  "summary": {
    "total_findings": 3,
    "critical": 1,
    "high": 1,
    "medium": 1,
    "low": 0
  },
  "findings": [
    {
      "id": "SKILLS-BLOCKED",
      "skill_source": "skills",
      "category": "discoverability",
      "title": "Site Blocked Bot Access (429)",
      "severity": "critical",
      "evidence": "Status: 429. Content indicates bot challenge or block.",
      "suggested_action": {
        "summary": "Allow AI crawlers",
        "detail": "Configure WAF/Cloudflare to whitelist known AI crawlers.",
        "priority": "critical",
        "effort": "low"
      }
    },
    {
      "id": "SCHEMA-001",
      "skill_source": "structured-data-audit",
      "category": "discoverability",
      "title": "No JSON-LD structured data found",
      "severity": "high",
      "evidence": "extruct parser found 0 JSON-LD objects on the page.",
      "suggested_action": {
        "summary": "Implement schema.org JSON-LD",
        "detail": "Add standard schema.org types like Organization, WebSite, or Product to help AI assistants understand your entities.",
        "priority": "high",
        "effort": "medium"
      }
    },
    {
      "id": "FRESH-001",
      "skill_source": "freshness-corroboration",
      "category": "discoverability",
      "title": "No date signals found",
      "severity": "medium",
      "evidence": "No <time> tags or JSON-LD date properties were found.",
      "suggested_action": {
        "summary": "Add publication and modification dates",
        "detail": "Use standard schema.org datePublished/dateModified and HTML5 <time> elements so AI knows the freshness of the content.",
        "priority": "medium",
        "effort": "low"
      }
    }
  ],
  "proactive_recommendations": [
    {
      "id": "R-001",
      "title": "Establish a consistent Knowledge Graph presence",
      "rationale": "Even if structured data is valid, explicitly linking to a maintained Wikipedia or Wikidata entity acts as an anchor for AI to ground facts about the brand.",
      "suggested_action": "Claim your Wikidata item, ensure Wikipedia is accurate, and link to them using JSON-LD sameAs."
    }
  ]
}