{
  "site": "www.dallasnews.com",
  "audited_at": "2026-09-12T14:41:18Z",
  "summary": {
    "total_findings": 4,
    "critical": 1,
    "high": 1,
    "medium": 2,
    "low": 0
  },
  "findings": [
    {
      "id": "CRAWL-001",
      "skill_source": "crawl-render-audit",
      "category": "discoverability",
      "title": "robots.txt blocks AI crawlers",
      "severity": "critical",
      "evidence": "The following AI bots are disallowed in robots.txt: GPTBot, Google-Extended, CCBot, anthropic-ai, ChatGPT-User",
      "suggested_action": {
        "summary": "Remove AI crawler blocks from robots.txt",
        "detail": "Allow AI bots to crawl the site to ensure inclusion in AI overviews and answers. Remove 'Disallow: /' for these User-agents.",
        "priority": "critical",
        "effort": "low"
      }
    },
    {
      "id": "CRAWL-003",
      "skill_source": "crawl-render-audit",
      "category": "discoverability",
      "title": "Missing or broken XML sitemap",
      "severity": "high",
      "evidence": "Attempted to fetch https://www.dallasnews.com/sitemap.xml but got status 404.",
      "suggested_action": {
        "summary": "Publish a valid XML sitemap",
        "detail": "Create a sitemap.xml at the domain root and list it in robots.txt.",
        "priority": "high",
        "effort": "low"
      }
    },
    {
      "id": "SCHEMA-002",
      "skill_source": "structured-data-audit",
      "category": "discoverability",
      "title": "Missing required properties in JSON-LD",
      "severity": "medium",
      "evidence": "Found these types missing a 'name' or 'headline' property: WebPage",
      "suggested_action": {
        "summary": "Ensure all schema blocks have a name",
        "detail": "Provide a descriptive name property for all schema.org entities.",
        "priority": "medium",
        "effort": "low"
      }
    },
    {
      "id": "FRESH-001",
      "skill_source": "freshness-corroboration",
      "category": "discoverability",
      "title": "No date signals found",
      "severity": "medium",
      "evidence": "No <time> tags or JSON-LD date properties were found.",
      "suggested_action": {
        "summary": "Add publication and modification dates",
        "detail": "Use standard schema.org datePublished/dateModified and HTML5 <time> elements so AI knows the freshness of the content.",
        "priority": "medium",
        "effort": "low"
      }
    }
  ],
  "proactive_recommendations": [
    {
      "id": "R-001",
      "title": "Establish a consistent Knowledge Graph presence",
      "rationale": "Even if structured data is valid, explicitly linking to a maintained Wikipedia or Wikidata entity acts as an anchor for AI to ground facts about the brand.",
      "suggested_action": "Claim your Wikidata item, ensure Wikipedia is accurate, and link to them using JSON-LD sameAs."
    },
    {
      "id": "R-002",
      "title": "Publish an AI Policy / Terms of Service",
      "rationale": "If you block some AI bots in robots.txt to protect IP, explicitly state what is allowed in a `/ai-policy` page. This ensures bots that respect advanced directives handle your content correctly.",
      "suggested_action": "Add an AI Terms page and use <meta name=\"robots\" content=\"noai\"> if needed, rather than blanket disallows."
    }
  ]
}