{
  "site": "nuxtjs.org",
  "audited_at": "2026-09-12T14:47:31Z",
  "summary": {
    "total_findings": 3,
    "critical": 0,
    "high": 1,
    "medium": 2,
    "low": 0
  },
  "findings": [
    {
      "id": "CRAWL-003",
      "skill_source": "crawl-render-audit",
      "category": "discoverability",
      "title": "Missing or broken XML sitemap",
      "severity": "high",
      "evidence": "Attempted to fetch https://nuxtjs.org/sitemap.xml but got status 404.",
      "suggested_action": {
        "summary": "Publish a valid XML sitemap",
        "detail": "Create a sitemap.xml at the domain root and list it in robots.txt.",
        "priority": "high",
        "effort": "low"
      }
    },
    {
      "id": "FRESH-001",
      "skill_source": "freshness-corroboration",
      "category": "discoverability",
      "title": "No date signals found",
      "severity": "medium",
      "evidence": "No <time> tags or JSON-LD date properties were found.",
      "suggested_action": {
        "summary": "Add publication and modification dates",
        "detail": "Use standard schema.org datePublished/dateModified and HTML5 <time> elements so AI knows the freshness of the content.",
        "priority": "medium",
        "effort": "low"
      }
    },
    {
      "id": "FRESH-003",
      "skill_source": "freshness-corroboration",
      "category": "discoverability",
      "title": "Outdated copyright year",
      "severity": "medium",
      "evidence": "Found copyright year 2016, but current year is 2026.",
      "suggested_action": {
        "summary": "Update copyright year",
        "detail": "A stale copyright year is a strong negative freshness signal to automated systems.",
        "priority": "medium",
        "effort": "low"
      }
    }
  ],
  "proactive_recommendations": [
    {
      "id": "R-002",
      "title": "Publish an AI Policy / Terms of Service",
      "rationale": "If you block some AI bots in robots.txt to protect IP, explicitly state what is allowed in a `/ai-policy` page. This ensures bots that respect advanced directives handle your content correctly.",
      "suggested_action": "Add an AI Terms page and use <meta name=\"robots\" content=\"noai\"> if needed, rather than blanket disallows."
    }
  ]
}