{
  "site": "magiceden.io",
  "audited_at": "2026-09-12T14:36:34Z",
  "summary": {
    "total_findings": 1,
    "critical": 1,
    "high": 0,
    "medium": 0,
    "low": 0
  },
  "findings": [
    {
      "id": "SKILLS-BLOCKED",
      "skill_source": "skills",
      "category": "discoverability",
      "title": "Site Blocked Bot Access (403)",
      "severity": "critical",
      "evidence": "Status: 403. Content indicates bot challenge or block.",
      "suggested_action": {
        "summary": "Allow AI crawlers",
        "detail": "Configure WAF/Cloudflare to whitelist known AI crawlers.",
        "priority": "critical",
        "effort": "low"
      }
    }
  ],
  "proactive_recommendations": []
}