{
  "site": "reactjs.org",
  "audited_at": "2026-09-12T14:47:01Z",
  "summary": {
    "total_findings": 7,
    "critical": 0,
    "high": 3,
    "medium": 3,
    "low": 1
  },
  "findings": [
    {
      "id": "CRAWL-003",
      "skill_source": "crawl-render-audit",
      "category": "discoverability",
      "title": "Missing or broken XML sitemap",
      "severity": "high",
      "evidence": "Attempted to fetch https://reactjs.org/sitemap.xml but got status 404.",
      "suggested_action": {
        "summary": "Publish a valid XML sitemap",
        "detail": "Create a sitemap.xml at the domain root and list it in robots.txt.",
        "priority": "high",
        "effort": "low"
      }
    },
    {
      "id": "SCHEMA-001",
      "skill_source": "structured-data-audit",
      "category": "discoverability",
      "title": "No JSON-LD structured data found",
      "severity": "high",
      "evidence": "extruct parser found 0 JSON-LD objects on the page.",
      "suggested_action": {
        "summary": "Implement schema.org JSON-LD",
        "detail": "Add standard schema.org types like Organization, WebSite, or Product to help AI assistants understand your entities.",
        "priority": "high",
        "effort": "medium"
      }
    },
    {
      "id": "IDENT-001",
      "skill_source": "entity-identity-audit",
      "category": "discoverability",
      "title": "Missing Organization/Brand Schema",
      "severity": "high",
      "evidence": "No structured data (JSON-LD, Microdata, RDFa) block of type Organization, Brand, LocalBusiness, or WebSite was found.",
      "suggested_action": {
        "summary": "Add Organization or Brand Schema",
        "detail": "Implement Organization schema to explicitly define your brand identity to AI search engine crawlers.",
        "priority": "high",
        "effort": "low"
      }
    },
    {
      "id": "SCHEMA-006",
      "skill_source": "structured-data-audit",
      "category": "engagement",
      "title": "Facts locked in images (Missing alt text)",
      "severity": "medium",
      "evidence": "24 out of 43 images are missing alt text.",
      "suggested_action": {
        "summary": "Add descriptive alt attributes",
        "detail": "If images contain facts or text, ensure they have alt tags so AI can extract the data.",
        "priority": "medium",
        "effort": "medium"
      }
    },
    {
      "id": "FRESH-001",
      "skill_source": "freshness-corroboration",
      "category": "discoverability",
      "title": "No date signals found",
      "severity": "medium",
      "evidence": "No <time> tags or JSON-LD date properties were found.",
      "suggested_action": {
        "summary": "Add publication and modification dates",
        "detail": "Use standard schema.org datePublished/dateModified and HTML5 <time> elements so AI knows the freshness of the content.",
        "priority": "medium",
        "effort": "low"
      }
    },
    {
      "id": "FRESH-003",
      "skill_source": "freshness-corroboration",
      "category": "discoverability",
      "title": "Outdated copyright year",
      "severity": "medium",
      "evidence": "Found copyright year 1004, but current year is 2026.",
      "suggested_action": {
        "summary": "Update copyright year",
        "detail": "A stale copyright year is a strong negative freshness signal to automated systems.",
        "priority": "medium",
        "effort": "low"
      }
    },
    {
      "id": "ENGAGE-004",
      "skill_source": "engagement-audit",
      "category": "engagement",
      "title": "Multiple unsectioned H1 tags",
      "severity": "low",
      "evidence": "Found 2 main headings without separate HTML5 sectioning elements.",
      "suggested_action": {
        "summary": "Scope H1 tags within sectioning elements or restrict to single top-level H1",
        "detail": "Encapsulate secondary H1 tags inside <section> or <article> elements, or use H2/H3 for subsections.",
        "priority": "low",
        "effort": "low"
      }
    }
  ],
  "proactive_recommendations": [
    {
      "id": "R-001",
      "title": "Establish a consistent Knowledge Graph presence",
      "rationale": "Even if structured data is valid, explicitly linking to a maintained Wikipedia or Wikidata entity acts as an anchor for AI to ground facts about the brand.",
      "suggested_action": "Claim your Wikidata item, ensure Wikipedia is accurate, and link to them using JSON-LD sameAs."
    },
    {
      "id": "R-002",
      "title": "Publish an AI Policy / Terms of Service",
      "rationale": "If you block some AI bots in robots.txt to protect IP, explicitly state what is allowed in a `/ai-policy` page. This ensures bots that respect advanced directives handle your content correctly.",
      "suggested_action": "Add an AI Terms page and use <meta name=\"robots\" content=\"noai\"> if needed, rather than blanket disallows."
    }
  ]
}