{
  "site": "www.netflix.com",
  "audited_at": "2026-09-12T14:48:53Z",
  "summary": {
    "total_findings": 12,
    "critical": 1,
    "high": 6,
    "medium": 5,
    "low": 0
  },
  "findings": [
    {
      "id": "CRAWL-001",
      "skill_source": "crawl-render-audit",
      "category": "discoverability",
      "title": "robots.txt blocks AI crawlers",
      "severity": "critical",
      "evidence": "The following AI bots are disallowed in robots.txt: CCBot, anthropic-ai",
      "suggested_action": {
        "summary": "Remove AI crawler blocks from robots.txt",
        "detail": "Allow AI bots to crawl the site to ensure inclusion in AI overviews and answers. Remove 'Disallow: /' for these User-agents.",
        "priority": "critical",
        "effort": "low"
      }
    },
    {
      "id": "CRAWL-005",
      "skill_source": "crawl-render-audit",
      "category": "discoverability",
      "title": "Missing canonical URL",
      "severity": "high",
      "evidence": "No <link rel=\"canonical\"> tag found in the HTML <head>.",
      "suggested_action": {
        "summary": "Add a canonical URL tag",
        "detail": "Add a <link rel=\"canonical\" href=\"...\"> tag to prevent duplicate content issues.",
        "priority": "high",
        "effort": "low"
      }
    },
    {
      "id": "CRAWL-003",
      "skill_source": "crawl-render-audit",
      "category": "discoverability",
      "title": "Invalid XML sitemap",
      "severity": "high",
      "evidence": "Sitemap at https://www.netflix.com/sitemap.xml could not be parsed as valid XML.",
      "suggested_action": {
        "summary": "Fix sitemap XML syntax",
        "detail": "Validate your sitemap against the standard XML schema.",
        "priority": "high",
        "effort": "low"
      }
    },
    {
      "id": "SCHEMA-001",
      "skill_source": "structured-data-audit",
      "category": "discoverability",
      "title": "No JSON-LD structured data found",
      "severity": "high",
      "evidence": "extruct parser found 0 JSON-LD objects on the page.",
      "suggested_action": {
        "summary": "Implement schema.org JSON-LD",
        "detail": "Add standard schema.org types like Organization, WebSite, or Product to help AI assistants understand your entities.",
        "priority": "high",
        "effort": "medium"
      }
    },
    {
      "id": "FRESH-004",
      "skill_source": "freshness-corroboration",
      "category": "discoverability",
      "title": "Inconsistent on-page facts (Title vs H1)",
      "severity": "high",
      "evidence": "Title ('Netflix') and H1 ('Enter your info to sign in') have zero overlap in words, indicating potential confusion.",
      "suggested_action": {
        "summary": "Align Title and H1 tags",
        "detail": "Ensure your primary H1 heading and page <title> are topically consistent to give strong entity signals.",
        "priority": "high",
        "effort": "low"
      }
    },
    {
      "id": "IDENT-001",
      "skill_source": "entity-identity-audit",
      "category": "discoverability",
      "title": "Missing Organization/Brand Schema",
      "severity": "high",
      "evidence": "No structured data (JSON-LD, Microdata, RDFa) block of type Organization, Brand, LocalBusiness, or WebSite was found.",
      "suggested_action": {
        "summary": "Add Organization or Brand Schema",
        "detail": "Implement Organization schema to explicitly define your brand identity to AI search engine crawlers.",
        "priority": "high",
        "effort": "low"
      }
    },
    {
      "id": "ENGAGE-005",
      "skill_source": "engagement-audit",
      "category": "engagement",
      "title": "Client-Side Rendered (CSR) SPA content hidden from basic AI crawlers",
      "severity": "high",
      "evidence": "Raw HTML contains only ~55 visible words because content relies on client-side JavaScript rendering.",
      "suggested_action": {
        "summary": "Implement Server-Side Rendering (SSR) or Prerendering",
        "detail": "Use SSR (e.g. Next.js, Nuxt) or prerendering services so non-JS AI crawlers can read full page content.",
        "priority": "high",
        "effort": "high"
      }
    },
    {
      "id": "SCHEMA-005",
      "skill_source": "structured-data-audit",
      "category": "discoverability",
      "title": "Missing OpenGraph tags",
      "severity": "medium",
      "evidence": "og:title present: False, og:description present: True",
      "suggested_action": {
        "summary": "Implement OpenGraph tags",
        "detail": "Add standard OpenGraph tags (og:title, og:description, og:image) for better snippet rendering across platforms and assistants.",
        "priority": "medium",
        "effort": "low"
      }
    },
    {
      "id": "SCHEMA-006",
      "skill_source": "structured-data-audit",
      "category": "engagement",
      "title": "Facts locked in images (Missing alt text)",
      "severity": "medium",
      "evidence": "1 out of 1 images are missing alt text.",
      "suggested_action": {
        "summary": "Add descriptive alt attributes",
        "detail": "If images contain facts or text, ensure they have alt tags so AI can extract the data.",
        "priority": "medium",
        "effort": "medium"
      }
    },
    {
      "id": "FRESH-001",
      "skill_source": "freshness-corroboration",
      "category": "discoverability",
      "title": "No date signals found",
      "severity": "medium",
      "evidence": "No <time> tags or JSON-LD date properties were found.",
      "suggested_action": {
        "summary": "Add publication and modification dates",
        "detail": "Use standard schema.org datePublished/dateModified and HTML5 <time> elements so AI knows the freshness of the content.",
        "priority": "medium",
        "effort": "low"
      }
    },
    {
      "id": "ENGAGE-001",
      "skill_source": "engagement-audit",
      "category": "engagement",
      "title": "Missing semantic navigation structure",
      "severity": "medium",
      "evidence": "Did not find <nav> elements, role='navigation', or header menu containers with links.",
      "suggested_action": {
        "summary": "Use semantic HTML5 <nav> or ARIA navigation roles",
        "detail": "Wrap main navigation menus in <nav> tags or role='navigation' to provide clear structure for AI crawlers.",
        "priority": "medium",
        "effort": "low"
      }
    },
    {
      "id": "ENGAGE-006",
      "skill_source": "engagement-audit",
      "category": "engagement",
      "title": "No obvious Call to Action (CTA)",
      "severity": "medium",
      "evidence": "Did not detect standard CTA actions (buy, sign up, contact, learn, try, search, connect) in interactive elements.",
      "suggested_action": {
        "summary": "Add clear CTAs",
        "detail": "Guide visitors and AI agents to primary conversion or engagement actions.",
        "priority": "medium",
        "effort": "low"
      }
    }
  ],
  "proactive_recommendations": [
    {
      "id": "R-001",
      "title": "Establish a consistent Knowledge Graph presence",
      "rationale": "Even if structured data is valid, explicitly linking to a maintained Wikipedia or Wikidata entity acts as an anchor for AI to ground facts about the brand.",
      "suggested_action": "Claim your Wikidata item, ensure Wikipedia is accurate, and link to them using JSON-LD sameAs."
    },
    {
      "id": "R-002",
      "title": "Publish an AI Policy / Terms of Service",
      "rationale": "If you block some AI bots in robots.txt to protect IP, explicitly state what is allowed in a `/ai-policy` page. This ensures bots that respect advanced directives handle your content correctly.",
      "suggested_action": "Add an AI Terms page and use <meta name=\"robots\" content=\"noai\"> if needed, rather than blanket disallows."
    }
  ]
}