{
  "site": "www.chicagotribune.com",
  "audited_at": "2026-09-12T14:41:04Z",
  "summary": {
    "total_findings": 2,
    "critical": 1,
    "high": 0,
    "medium": 0,
    "low": 1
  },
  "findings": [
    {
      "id": "CRAWL-001",
      "skill_source": "crawl-render-audit",
      "category": "discoverability",
      "title": "robots.txt blocks AI crawlers",
      "severity": "critical",
      "evidence": "The following AI bots are disallowed in robots.txt: GPTBot, Google-Extended, CCBot, anthropic-ai, ChatGPT-User",
      "suggested_action": {
        "summary": "Remove AI crawler blocks from robots.txt",
        "detail": "Allow AI bots to crawl the site to ensure inclusion in AI overviews and answers. Remove 'Disallow: /' for these User-agents.",
        "priority": "critical",
        "effort": "low"
      }
    },
    {
      "id": "ENGAGE-004",
      "skill_source": "engagement-audit",
      "category": "engagement",
      "title": "Multiple unsectioned H1 tags",
      "severity": "low",
      "evidence": "Found 2 main headings without separate HTML5 sectioning elements.",
      "suggested_action": {
        "summary": "Scope H1 tags within sectioning elements or restrict to single top-level H1",
        "detail": "Encapsulate secondary H1 tags inside <section> or <article> elements, or use H2/H3 for subsections.",
        "priority": "low",
        "effort": "low"
      }
    }
  ],
  "proactive_recommendations": [
    {
      "id": "R-002",
      "title": "Publish an AI Policy / Terms of Service",
      "rationale": "If you block some AI bots in robots.txt to protect IP, explicitly state what is allowed in a `/ai-policy` page. This ensures bots that respect advanced directives handle your content correctly.",
      "suggested_action": "Add an AI Terms page and use <meta name=\"robots\" content=\"noai\"> if needed, rather than blanket disallows."
    }
  ]
}